<?xml version="1.0" encoding="utf-8"?>
<dbrevision-structure:SchemaElement xmlns:dbrevision-structure="http://dbrevision.sourceforge.net/xsd/dbrevision-structure.xsd" xmlns:xsi="http://www.w3.org/2001/XMLSchema-instance" xsi:schemaLocation="http://dbrevision.sourceforge.net/xsd/dbrevision-structure.xsd
dbrevision-structure.xsd">

	<Table schema="TEST" name="WM_PORTAL_IDS" type="TABLE">
		<Field name="sequence_name" dataType="VARCHAR2" javaType="12" javaStringType="java.sql.Types.VARCHAR" size="50" nullable="1"/>
		<Field name="sequence_next_value" dataType="NUMBER" javaType="3" javaStringType="java.sql.Types.DECIMAL" size="10" decimalDigit="0" nullable="1"/>
	</Table>
	<Table schema="TEST" name="WM_AUTH_ACCESS_GROUP" type="TABLE">
		<PrimaryKey>
			<Column schemaName="TEST" tableName="WM_AUTH_ACCESS_GROUP" columnName="ID_ACCESS_GROUP" keySeq="1" pkName="ID_AG_AAG_PK"/>
		</PrimaryKey>
		<Field name="ID_ACCESS_GROUP" dataType="NUMBER" javaType="3" javaStringType="java.sql.Types.DECIMAL" size="10" decimalDigit="0" nullable="0"/>
		<Field name="NAME_ACCESS_GROUP" dataType="VARCHAR2" javaType="12" javaStringType="java.sql.Types.VARCHAR" size="100" nullable="1"/>
	</Table>

	<Sequence name="SEQ_WM_PRICE_QUERY_TABLE" minValue="1" maxValue="999999999999999999999999" incrementBy="1" isCycle="false" isOrder="false" cacheSize="0" lastNumber="29"/>
</dbrevision-structure:SchemaElement>
